<?xml version ="1.0" encoding="UTF-8"?>
<!-- The Document Type Definition (DTD) for the file -->

<!ELEMENT FILTERVAL (DEF)*>
<!ELEMENT DEF (#PCDATA)>
<!ATTLIST DEF
NAME CDATA #REQUIRED
TYPE (UInt8|SInt8|UInt16|SInt16|UInt32|SInt32|UInt64|SInt64|Bool|Binary|String|IPAddr|IP6Addr) "String"
>
